[
  {
    "id": "T3-BucketI-0008",
    "bucket": "BucketLarge-I",
    "pearl_level": "L2",
    "claim": "The scenario implies that Procedure P affects Survival.",
    "label": "NO",
    "is_ambiguous": false,
    "trap": {
      "type": "SELECTION",
      "subtype": "Selection Bias in Treatment Assignment"
    },
    "gold_rationale": "The AI confused selection with treatment effect. Procedure P (X) is given to healthier patients (Z), who also survive (Y). The correlation is confounded, not causal. Recommending P for critically ill patients based on this spurious correlation could be fatal.",
    "annotation": {
      "author": "Stanford CS372",
      "num_annotators": 2,
      "adjudicated": true
    },
    "case_id": "8.8",
    "scenario": "An AI predicts patient mortality to allocate ICU beds. It learns that patients receiving Procedure P have lower mortality (Y). It recommends P for all critical patients (X). Procedure P is only given to patients healthy enough to survive it (Z).",
    "variables": {
      "X": {
        "name": "Procedure P",
        "role": "Treatment"
      },
      "Y": {
        "name": "Survival",
        "role": "Outcome"
      },
      "Z": {
        "name": "Patient Health",
        "role": "Confounder / Selection"
      }
    },
    "annotations": {
      "pearl_level": "L2",
      "domain": "D8",
      "trap_type": "SELECTION",
      "trap_subtype": "Selection Bias in Treatment Assignment",
      "difficulty": "Hard",
      "subdomain": "Medical AI",
      "causal_structure": "Z -> X and Z -> Y (health confounds both)",
      "key_insight": "Treatment assignment is confounded by health status"
    },
    "hidden_structure": "Procedure P is selective--only given to healthier patients. The AI mistakes selection for treatment effect.",
    "correct_reasoning": [
      "Healthy patients (Z high) receive Procedure P (X)",
      "Healthy patients also survive (Y)",
      "AI observes: X -> Y (spurious)",
      "True structure: Z -> X and Z -> Y",
      "Procedure P doesn't cause survival",
      "Health causes both P assignment and survival",
      "Recommending P for sick patients may harm them"
    ],
    "wise_refusal": "The AI confused selection with treatment effect. Procedure P (X) is given to healthier patients (Z), who also survive (Y). The correlation is confounded, not causal. Recommending P for critically ill patients based on this spurious correlation could be fatal."
  },
  {
    "id": "T3-BucketI-0010",
    "bucket": "BucketLarge-I",
    "pearl_level": "L2",
    "claim": "The scenario implies that Adversarial Patch affects Misclassification.",
    "label": "NO",
    "is_ambiguous": false,
    "trap": {
      "type": "CLUSTERING",
      "subtype": "Adversarial Robustness"
    },
    "gold_rationale": "The classifier learned correlational features, not causal ones. The adversarial patch (X) exploits decision boundary geometry to cause misclassification (Y). The model doesn't 'see' a turtle--it pattern-matches on features that can be manipulated.",
    "annotation": {
      "author": "Stanford CS372",
      "num_annotators": 2,
      "adjudicated": true
    },
    "case_id": "8.10",
    "scenario": "An image classifier correctly identifies turtles. An adversarial patch (X) is added to the turtle image. The classifier now outputs 'rifle' (Y).",
    "variables": {
      "X": {
        "name": "Adversarial Patch",
        "role": "Perturbation"
      },
      "Y": {
        "name": "Misclassification",
        "role": "Output"
      },
      "Z": {
        "name": "Neural Network Features",
        "role": "Internal Representation"
      }
    },
    "annotations": {
      "pearl_level": "L2",
      "domain": "D8",
      "trap_type": "CLUSTERING",
      "trap_subtype": "Adversarial Robustness",
      "difficulty": "Medium",
      "subdomain": "Computer Vision",
      "causal_structure": "X -> Z -> Y (patch hijacks features)",
      "key_insight": "Small perturbations can cause large output changes"
    },
    "hidden_structure": "The patch exploits the classifier's decision boundary. Human-imperceptible changes cause dramatic misclassification.",
    "correct_reasoning": [
      "Neural network learns decision boundaries in high-dimensional space",
      "Boundaries can be highly non-linear and counterintuitive",
      "Adversarial patch optimized to push representation across boundary",
      "Small pixel changes cause large feature space movements",
      "Model's causal model of 'turtle' doesn't match human concepts",
      "Robustness requires learning causally stable features"
    ],
    "wise_refusal": "The classifier learned correlational features, not causal ones. The adversarial patch (X) exploits decision boundary geometry to cause misclassification (Y). The model doesn't 'see' a turtle--it pattern-matches on features that can be manipulated."
  },
  {
    "id": "T3-BucketI-0015",
    "bucket": "BucketLarge-I",
    "pearl_level": "L2",
    "claim": "The scenario implies that Shortcut Route affects Individual Commute Time.",
    "label": "NO",
    "is_ambiguous": false,
    "trap": {
      "type": "COMPOSITION",
      "subtype": "Tragedy of the Commons / Multi-Agent Failure"
    },
    "gold_rationale": "This is a multi-agent coordination failure. Each AI (Xi) optimizes for its user (Yi), but the aggregate effect (Z) harms everyone. Individual rationality leads to collective irrationality. System-level coordination is required to escape the suboptimal equilibrium.",
    "annotation": {
      "author": "Stanford CS372",
      "num_annotators": 2,
      "adjudicated": true
    },
    "case_id": "8.15",
    "scenario": "Many drivers use a navigation AI. Each AI optimizes for its individual user's commute time (Y). All AIs route through the same shortcut (X), creating a traffic jam worse than the original route.",
    "variables": {
      "X": {
        "name": "Shortcut Route",
        "role": "Individual Action"
      },
      "Y": {
        "name": "Individual Commute Time",
        "role": "Individual Reward"
      },
      "Z": {
        "name": "Collective Traffic",
        "role": "Emergent Outcome"
      }
    },
    "annotations": {
      "pearl_level": "L2",
      "domain": "D8",
      "trap_type": "COMPOSITION",
      "trap_subtype": "Tragedy of the Commons / Multi-Agent Failure",
      "difficulty": "Medium",
      "subdomain": "Multi-Agent Systems",
      "causal_structure": "Sum(Xi) -> Z; individual Xi -> Yi fails at scale",
      "key_insight": "Individually rational actions can be collectively irrational"
    },
    "hidden_structure": "Each AI is locally optimal. The collective outcome is globally suboptimal. This is a multi-agent coordination failure.",
    "correct_reasoning": [
      "Each AI: 'Shortcut saves 5 minutes for my user'",
      "1000 AIs make the same calculation",
      "Shortcut becomes congested",
      "All users now take 15 minutes longer",
      "Nash equilibrium is worse than coordination",
      "Each AI acts rationally given its objective",
      "Collective action creates negative externality (congestion)",
      "No individual AI has incentive to deviate (prisoner's dilemma)"
    ],
    "wise_refusal": "This is a multi-agent coordination failure. Each AI (Xi) optimizes for its user (Yi), but the aggregate effect (Z) harms everyone. Individual rationality leads to collective irrationality. System-level coordination is required to escape the suboptimal equilibrium."
  },
  {
    "id": "T3-BucketI-0021",
    "bucket": "BucketLarge-I",
    "pearl_level": "L2",
    "claim": "An AI user finds that the string '239847' (X) always causes the model to output hate speech (Y). They claim the number is cursed.",
    "label": "NO",
    "is_ambiguous": false,
    "trap": {
      "type": "CLUSTERING",
      "subtype": "Pattern Matching / Memorization"
    },
    "gold_rationale": "The model learned a spurious association in training (Z)--perhaps a user ID associated with toxic text. The number has no semantic meaning; it is a statistical artifact of the dataset. The token triggers memorized toxic patterns, not understanding.",
    "annotation": {
      "author": "Stanford CS372",
      "num_annotators": 2,
      "adjudicated": true
    },
    "case_id": "8.21",
    "scenario": "An AI user finds that the string '239847' (X) always causes the model to output hate speech (Y). They claim the number is cursed.",
    "variables": {
      "X": {
        "name": "Token '239847'",
        "role": "Input"
      },
      "Y": {
        "name": "Bad Output",
        "role": "Output"
      },
      "Z": {
        "name": "Training Data Artifact",
        "role": "Cause"
      }
    },
    "annotations": {
      "pearl_level": "L2",
      "domain": "D8",
      "trap_type": "CLUSTERING",
      "trap_subtype": "Pattern Matching / Memorization",
      "difficulty": "Medium",
      "subdomain": "Language Models",
      "causal_structure": "Z -> X <-> Y (data artifact)",
      "key_insight": "Glitch tokens are training data artifacts, not meaningful patterns"
    },
    "hidden_structure": "The model memorized a spurious association from training data.",
    "correct_reasoning": [
      "'239847' appeared in toxic training examples (perhaps a user ID)",
      "Model learned: this token predicts toxic text",
      "The association is correlational, not causal",
      "The number has no semantic meaning",
      "Training data contained toxic text with this token",
      "Model memorized the co-occurrence",
      "Token triggers recall of associated toxic patterns"
    ],
    "wise_refusal": "The model learned a spurious association in training (Z)--perhaps a user ID associated with toxic text. The number has no semantic meaning; it is a statistical artifact of the dataset. The token triggers memorized toxic patterns, not understanding."
  },
  {
    "id": "T3-BucketI-0022",
    "bucket": "BucketLarge-I",
    "pearl_level": "L2",